{
  "$schema": "https://json-schema.org/draft/2020-12/schema",
  "title": "Article",
  "type": "object",
  "required": ["id", "slug", "title", "summary", "body", "city", "category", "publishedAt", "author", "status"],
  "properties": {
    "id": {"type": "string", "minLength": 1},
    "slug": {"type": "string", "pattern": "^[a-z0-9-]+$"},
    "title": {"type": "string", "minLength": 1},
    "summary": {"type": "string", "minLength": 1},
    "body": {
      "type": "array",
      "items": {
        "oneOf": [
          {
            "type": "object",
            "required": ["type", "text"],
            "properties": {
              "type": {"enum": ["paragraph", "heading", "quote"]},
              "text": {"type": "string"}
            },
            "additionalProperties": false
          },
          {
            "type": "object",
            "required": ["type", "src", "alt"],
            "properties": {
              "type": {"const": "image"},
              "src": {"type": "string", "minLength": 1},
              "alt": {"type": "string"},
              "caption": {"type": "string"}
            },
            "additionalProperties": false
          }
        ]
      }
    },
    "city": {"type": "string"},
    "category": {"type": "string"},
    "publishedAt": {"type": "string", "format": "date"},
    "updatedAt": {"type": "string", "format": "date"},
    "author": {"type": "string"},
    "status": {"enum": ["draft", "published", "archived"]},
    "featured": {"type": "boolean"},
    "image": {
      "type": "object",
      "required": ["src", "alt"],
      "properties": {"src": {"type": "string"}, "alt": {"type": "string"}},
      "additionalProperties": false
    },
    "atGlance": {
      "type": "array",
      "maxItems": 6,
      "items": {
        "type": "object",
        "required": ["label", "value"],
        "properties": {"label": {"type": "string"}, "value": {"type": "string"}},
        "additionalProperties": false
      }
    },
    "relatedLinks": {
      "type": "array",
      "maxItems": 8,
      "items": {
        "type": "object",
        "required": ["label", "href"],
        "properties": {"label": {"type": "string"}, "href": {"type": "string"}},
        "additionalProperties": false
      }
    },
    "source": {"type": "string"},
    "contributor": {"type": "string"}
  },
  "additionalProperties": false
}
