{
  "id": "welcome-to-australian-hazaras",
  "slug": "welcome-to-australian-hazaras",
  "title": "Welcome to Australian Hazaras",
  "summary": "A community platform for news, achievements, events and Census information.",
  "body": [
    {
      "type": "paragraph",
      "text": "Australian Hazaras brings together community information from cities across Australia."
    },
    {
      "type": "paragraph",
      "text": "This website is structured so new articles, events and achievements can be added without editing page layouts."
    }
  ],
  "city": "melbourne",
  "category": "news",
  "publishedAt": "2026-07-20",
  "updatedAt": "2026-07-20",
  "author": "Australian Hazaras",
  "status": "archived",
  "featured": true,
  "image": {
    "src": "assets/images/banners/melbourne-1024.webp",
    "alt": "Melbourne city skyline"
  },
  "atGlance": [],
  "relatedLinks": [],
  "source": "Australian Hazara Community",
  "contributor": "Australian Hazaras"
}
