{
  "id": "beauty-of-hazaras-in-austrlia",
  "slug": "beauty-of-hazaras-in-austrlia",
  "title": "Beauty of Hazaras in Austrlia",
  "summary": "Beauty of Hazaras in Australia Your news story headline will appear here\nYour news story headline will appear here Your news story headline will appear here",
  "body": [],
  "city": "melbourne",
  "category": "arts-culture",
  "publishedAt": "2026-07-20",
  "updatedAt": "2026-07-20",
  "author": "Australian Hazaras",
  "status": "draft",
  "featured": false,
  "image": {
    "src": "assets/images/articles/beauty-of-hazaras-in-austrlia-featured-2-1024.webp",
    "alt": "Melbourne beauty"
  },
  "atGlance": [
    {
      "label": "Community",
      "value": ""
    },
    {
      "label": "Location",
      "value": ""
    },
    {
      "label": "Impact",
      "value": ""
    }
  ],
  "relatedLinks": [],
  "source": "Australian Hazara Community",
  "contributor": "Australian Hazaras"
}
